title,link
Lone Fed dissenter explains why she opposed jumbo rate cut,https://finance.yahoo.com/news/lone-fed-dissenter-worried-bigger-rate-cut-would-send-signal-of-economic-fragility-132354015.html
Stocks wobble as consumer confidence tumbles,https://finance.yahoo.com/news/live/stock-market-today-us-stocks-mixed-as-investors-digest-fedspeak-falling-consumer-confidence-133233677.html
"The S&P 6,000 calls are starting to feel reasonable",https://finance.yahoo.com/news/the-sp-6000-calls-are-starting-to-feel-reasonable-morning-brief-100018236.html
China unleashes biggest stimulus since pandemic,https://finance.yahoo.com/news/china-central-bank-cut-banks-013744885.html
Boeing makes offer directly to striking workers as union balks,https://finance.yahoo.com/news/boeing-offers-union-30-wage-202651534.html
Musk hints Tesla is looking to invest in lithium-rich Argentina,https://finance.yahoo.com/news/musk-says-companies-looking-invest-131755119.html
Disney's parks are losing their magic. Is the slowdown a blip?,https://finance.yahoo.com/news/disneys-theme-parks-have-seen-a-slowdown-is-it-a-temporary-blip-164359711.html
Starbucks downgraded with turnaround said to need time,https://finance.yahoo.com/news/starbucks-stock-downgraded-as-turnaround-will-need-more-time-analyst-says-125250827.html
US home prices edge up in July as overall pace slackens,https://finance.yahoo.com/news/us-monthly-house-prices-edge-130253373.html
Trump's rate cap may not help those deep in credit-card debt,https://finance.yahoo.com/news/americans-drowning-credit-card-debt-093019195.html
"Paramount Global begins second phase of layoffs in U.S., internal memo says",https://finance.yahoo.com/news/paramount-global-begins-second-phase-144553142.html
FAA says Boeing safety culture reforms may take years,https://finance.yahoo.com/news/faa-says-boeing-safety-culture-144516328.html
Maryland sues the owner and manager of the ship that caused the Key Bridge collapse,https://finance.yahoo.com/news/maryland-sues-owner-manager-ship-144022007.html
"US fiscal profile set to weaken under next administration, Moody's says",https://finance.yahoo.com/news/us-fiscal-profile-set-weaken-143912634.html
"Spotify expands AI Playlist feature to new markets including US, Canada",https://finance.yahoo.com/news/spotify-expands-ai-playlist-feature-143642133.html
US consumer confidence ebbs in September on labor market fears,https://finance.yahoo.com/news/us-consumer-confidence-ebbs-september-143351177.html
Stocks Rally Stalls as Consumer Sentiment Hit: Markets Wrap,https://finance.yahoo.com/news/asian-stocks-eye-gains-fresh-224627383.html
"A Chatbot That Gives Stock Buy, Sell Advice Cleared by Israel",https://finance.yahoo.com/news/chatbot-gives-stock-buy-sell-142209837.html
,https://finance.yahoo.com/personal-finance/marriott-bonvoy-credit-card-offer-001733487.html
"PBOC announces stimulus package, Chinese stocks jump",https://finance.yahoo.com/video/pboc-announces-stimulus-package-chinese-143250874.html
"These are the two things driving Tesla's stock, analyst says",https://finance.yahoo.com/video/two-things-driving-teslas-stock-142405174.html
Google Gemini to power Snapchat’s AI chatbot,https://finance.yahoo.com/video/google-gemini-power-snapchat-ai-141059785.html
Boeing's 'final offer' rejected by machinists union,https://finance.yahoo.com/video/boeings-final-offer-rejected-machinists-140900386.html
"8 smart money moves to make with $1,000 in savings",https://finance.yahoo.com/personal-finance/1000-savings-money-moves-175214102.html
Check kiting goes viral on social media. Is it bank fraud?,https://finance.yahoo.com/personal-finance/check-kiting-193100699.html
How to maximize your savings following the Fed's rate cut,https://finance.yahoo.com/personal-finance/maximize-interest-earnings-fed-rate-cuts-163621272.html
What the Fed rate cut means for your money,https://finance.yahoo.com/personal-finance/what-a-fed-rate-cut-would-mean-for-bank-accounts-cds-loans-and-credit-cards-183320880.html
How banks are softening the blow of falling deposit rates,https://finance.yahoo.com/personal-finance/new-bank-account-bonuses-214704427.html
What happens to your mortgage during a divorce?,https://finance.yahoo.com/personal-finance/divorce-and-mortgage-174118788.html
How long does it take to refinance a house?,https://finance.yahoo.com/personal-finance/how-long-does-it-take-to-refinance-a-house-190121845.html
These are the pros and cons of refinancing your home,https://finance.yahoo.com/personal-finance/pros-and-cons-of-refinancing-your-home-215941743.html
What credit card users need to know as Fed slashes rates,https://finance.yahoo.com/personal-finance/fed-rates-cut-credit-cards-221927805.html
What happens to credit card debt when you die?,https://finance.yahoo.com/personal-finance/what-happens-to-credit-card-debt-when-you-die-195732443.html
DJT stock plummets to new lows after lockup period expires,https://finance.yahoo.com/news/djt-stock-plummets-to-new-lows-after-lockup-period-expires-174815865.html
Trump's $2 billion — and shrinking — decision over his social media empire,https://finance.yahoo.com/news/trump-2-billion-truth-social-093019543.html
But he says he won't sell any shares,https://finance.yahoo.com/news/donald-trump-said-he-would-not-sell-his-truth-social-stock-but-he-technically-can-starting-thursday-202101942.html
Bank investors are now betting 2024 could be the start of another 1995,https://finance.yahoo.com/news/bank-investors-are-now-betting-2024-could-be-the-start-of-another-1995-171430722.html
